{
  "id": "html-css-native",
  "name": "Native HTML and CSS (DOM text, layout, clip-path, filters)",
  "version": "native",
  "category": "vector_graphics",
  "status": "approved",
  "licensing": {
    "spdx_identifier": "W3C-Software-Notice",
    "status": "verified",
    "commercial_use": true,
    "attribution_required": false,
    "notes": "Open web standards implemented natively in Chromium/Blink."
  },
  "documentation_urls": [
    "https://developer.mozilla.org/en-US/docs/Web/CSS"
  ],
  "runtime_environment": {
    "type": "browser_native"
  },
  "rendering_constraints": {
    "max_memory_mb": 150,
    "target_fps": 30,
    "headless_chromium_compatible": true,
    "deterministic_mode_supported": true,
    "notes": "Animate transform, opacity, clip-path and CSS variables; avoid animating layout properties. Never set CSS transform on GSAP-animated elements (HyperFrames lint gsap_css_transform_conflict)."
  },
  "compatibility": {
    "apple_silicon_tested": true,
    "hyperframes_compatible": true,
    "low_memory_mode_compatible": true
  },
  "justification": "Approved core technology: every existing composition already renders HTML text and CSS layout through HyperFrames. Registered explicitly so text, mask and layout primitives can declare their dependency.",
  "effects_provided": [],
  "metadata": {
    "author": "MotionLab",
    "created_at": "2026-10-30",
    "updated_at": "2026-10-30",
    "tags": [
      "html",
      "css",
      "dom",
      "text",
      "layout",
      "browser-native"
    ]
  }
}
