{
  "id": "threejs",
  "name": "Three.js 3D WebGL Library",
  "version": "0.160.0",
  "category": "webgl_3d",
  "status": "proposed",
  "licensing": {
    "spdx_identifier": "MIT",
    "status": "verified",
    "commercial_use": true,
    "attribution_required": false,
    "notes": "Standard MIT license allows commercial use and modification."
  },
  "documentation_urls": [
    "https://threejs.org/docs/"
  ],
  "runtime_environment": {
    "type": "browser_module",
    "bundle_size_kb": 650.0
  },
  "rendering_constraints": {
    "max_memory_mb": 2200,
    "target_fps": 30,
    "headless_chromium_compatible": false,
    "deterministic_mode_supported": false,
    "notes": "Headless Chromium WebGL context creation with ANGLE Metal on 8GB Apple Silicon risks exceeding memory budgets (>2GB) and frame-capture synchronization is unverified without custom RAF interception."
  },
  "compatibility": {
    "apple_silicon_tested": false,
    "hyperframes_compatible": false,
    "low_memory_mode_compatible": false
  },
  "justification": "PROPOSED ONLY: Candidate for true 3D spatial models. NOT currently approved for production because WebGL context management on 8GB Unified RAM exceeds the 1.5 GB memory budget and lacks verified HyperFrames timeline synchronization hooks.",
  "effects_provided": [],
  "metadata": {
    "author": "MotionLab",
    "created_at": "2026-10-30",
    "updated_at": "2026-10-30",
    "tags": ["3d", "webgl", "proposed", "mesh", "camera"]
  }
}

