{
  "id": "gsap",
  "name": "GreenSock Animation Platform (GSAP 3)",
  "version": "3.12.5",
  "category": "animation_engine",
  "status": "approved",
  "licensing": {
    "spdx_identifier": "Standard 'No Charge' GreenSock License",
    "status": "verified",
    "commercial_use": true,
    "attribution_required": false,
    "notes": "Verified for motion graphic video renders and digital media explainer productions. Standard license covers commercial usage unless end users are charged directly for software bundling GSAP."
  },
  "documentation_urls": [
    "https://gsap.com/docs/v3/"
  ],
  "runtime_environment": {
    "type": "browser_script",
    "cdn_url": "https://cdnjs.cloudflare.com/ajax/libs/gsap/3.12.5/gsap.min.js",
    "npm_package": "gsap",
    "bundle_size_kb": 67.5
  },
  "rendering_constraints": {
    "max_memory_mb": 250,
    "target_fps": 30,
    "headless_chromium_compatible": true,
    "deterministic_mode_supported": true,
    "notes": "Must instantiate timeline paused: true and mount to window.__timelines['root']. HyperFrames steps time deterministically."
  },
  "compatibility": {
    "apple_silicon_tested": true,
    "hyperframes_compatible": true,
    "low_memory_mode_compatible": true
  },
  "justification": "Approved core dependency. GSAP 3 is the foundational animation timeline engine for this repository. It guarantees frame-accurate deterministic stepping and integrates directly with HyperFrames capture without DOM thrashing.",
  "effects_provided": [
    "crossfade-dissolve",
    "traveling-packet",
    "marching-dashed-stroke",
    "clip-path-reveal",
    "glow-pulse"
  ],
  "metadata": {
    "author": "MotionLab",
    "created_at": "2026-10-30",
    "updated_at": "2026-10-30",
    "tags": ["timeline", "tweening", "core", "deterministic", "gsap3"]
  }
}

